{
  "$schema": "../schemas/lifecycle-profile-registry.schema.json",
  "schema_version": "lifecycle-profile-registry/v0",
  "registry_id": "lifecycle-profile-registry.semantic-guard-vnext",
  "version": "candidate-2026-07-16",
  "status": "candidate",
  "purpose": "依頼から完了主張までの十工程について、成果物名ではなく必須意味、関係、義務、証拠、未決定、人間判断境界を候補契約として閉じる。",
  "authority_boundary": {
    "adoption_owner": "human",
    "semantic_guard_adoption_authority": "none",
    "agent_adoption_authority": "none",
    "runtime_authority": "none",
    "final_acceptance_owner": "human"
  },
  "stage_order": [
    "request",
    "exploration",
    "requirement",
    "decision",
    "plan",
    "action",
    "realization",
    "diff",
    "verification",
    "completion"
  ],
  "profiles": [
    {
      "profile_id": "lifecycle-profile.request",
      "version": "0.1.0-candidate",
      "status": "pending_human_adoption",
      "stage": "request",
      "lifecycle_trace_stage": "request",
      "purpose": "依頼者の必要、対象、望む変化、範囲、制約、未知を、解決手段や推測と混ぜず監査可能な起点へする。",
      "entry_conditions": [
        {
          "condition_id": "request.source.identifiable",
          "statement": "依頼又は依頼の観測記録を識別できる。",
          "evidence_requirement": "依頼本文又は由来付き観測記録"
        }
      ],
      "exit_conditions": [
        {
          "condition_id": "request.meaning.externalized",
          "statement": "依頼者、必要、対象、望む変化、範囲、制約、未知、非目標が区別される。",
          "evidence_requirement": "構造化依頼記録と原文対応"
        }
      ],
      "required_semantic_fields": [
        {
          "field_id": "request.stakeholder",
          "meaning": "必要と受理判断を持つ主体。",
          "required": true,
          "absence_effect": "unresolved"
        },
        {
          "field_id": "request.need",
          "meaning": "解くべき問題又は得るべき価値。",
          "required": true,
          "absence_effect": "blocked"
        },
        {
          "field_id": "request.subject",
          "meaning": "監査と変更の対象。",
          "required": true,
          "absence_effect": "blocked"
        },
        {
          "field_id": "request.desired_outcome",
          "meaning": "対象に求める観測可能な変化。",
          "required": true,
          "absence_effect": "unresolved"
        },
        {
          "field_id": "request.boundary",
          "meaning": "範囲、制約、非目標、未知。",
          "required": true,
          "absence_effect": "unresolved"
        }
      ],
      "required_relationships": [
        {
          "relationship_id": "request.stakeholder_requests_outcome",
          "subject_role": "stakeholder",
          "predicate": "requests",
          "object_role": "desired_outcome",
          "cardinality": "one_or_more",
          "absence_effect": "blocked"
        },
        {
          "relationship_id": "request.need_justifies_outcome",
          "subject_role": "need",
          "predicate": "justifies",
          "object_role": "desired_outcome",
          "cardinality": "one_or_more",
          "absence_effect": "unresolved"
        },
        {
          "relationship_id": "request.boundary_constrains_subject",
          "subject_role": "boundary",
          "predicate": "constrains",
          "object_role": "subject",
          "cardinality": "one_or_more",
          "absence_effect": "unresolved"
        }
      ],
      "obligation_templates": [
        {
          "obligation_id": "obligation.request.engineering_audit_basis",
          "statement": "依頼の明確性、必要性、範囲、検証可能性を採択済み工学規則へ追跡する。",
          "origin_trace": [
            "OR-01"
          ],
          "required_evidence_types": [
            "rule_trace",
            "source_span"
          ],
          "absence_effect": "unresolved"
        },
        {
          "obligation_id": "obligation.request.bounded_claim_basis",
          "statement": "依頼に含まれる事実、推測、仮説、未決定を別命題として記録する。",
          "origin_trace": [
            "OR-02"
          ],
          "required_evidence_types": [
            "structured_request_record",
            "proposition_trace"
          ],
          "absence_effect": "unresolved"
        },
        {
          "obligation_id": "obligation.request.repair_and_human_material",
          "statement": "曖昧さと不足を修正質問及び人間判断材料へ変換できる。",
          "origin_trace": [
            "OR-03"
          ],
          "required_evidence_types": [
            "unresolved_register",
            "human_review_material"
          ],
          "absence_effect": "unresolved"
        }
      ],
      "non_goals": [
        "依頼文から実装手段又は優先順位を自動決定すること。",
        "依頼記録の存在を依頼者の最終受理と見なすこと。"
      ],
      "hollow_success_conditions": [
        {
          "condition_id": "request.hollow.artifact",
          "condition_kind": "artifact_presence_only",
          "statement": "依頼票は存在するが必要、対象、望む変化、境界が結び付いていない。"
        },
        {
          "condition_id": "request.hollow.lexical",
          "condition_kind": "lexical_match_only",
          "statement": "要求語彙の出現だけを明確な依頼命題と見なす。"
        }
      ],
      "verification_evidence_types": [
        {
          "evidence_type": "structured_request_record",
          "supports": "必須意味欄の外部化。",
          "does_not_establish": "依頼者本人性又は要求の妥当性。"
        },
        {
          "evidence_type": "source_span_trace",
          "supports": "構造化欄と観測原文の対応。",
          "does_not_establish": "記録外の意図の不存在。"
        }
      ],
      "validation_materials": [
        {
          "material_id": "request.material.record",
          "kind": "structured_record",
          "purpose": "依頼意味欄と未決定の検査。",
          "required": true
        },
        {
          "material_id": "request.material.rule_trace",
          "kind": "rule_trace",
          "purpose": "依頼監査基準の根拠と反適用条件の検査。",
          "required": true
        }
      ],
      "human_acceptance_questions": [
        {
          "question_id": "request.acceptance.intent",
          "question": "記録された必要、対象、望む変化、範囲はアナタの依頼意図を保っているか。",
          "owner": "human",
          "required": true
        }
      ],
      "unresolved": [
        {
          "unresolved_id": "unresolved.request.intent_completeness",
          "question": "記録外の重要な意図又は利害関係者が残っていないか。",
          "owner": "human",
          "blocking_effect": "後続工程の意味分母が暫定になる。",
          "resolution_evidence": "依頼者による確認又は修正記録"
        }
      ],
      "upstream_trace": {
        "origin_requirements": [
          "OR-01",
          "OR-02",
          "OR-03"
        ],
        "stage_refs": [],
        "inputs_carried": [
          "原点要求",
          "依頼原文又は観測記録"
        ]
      },
      "downstream_trace": {
        "stage_refs": [
          "exploration"
        ],
        "outputs_carried": [
          "対象付き依頼命題",
          "制約",
          "未知",
          "人間確認点"
        ]
      },
      "requalification_triggers": [
        {
          "trigger_id": "request.requal.intent_change",
          "condition": "依頼者が必要、対象、望む変化又は範囲を修正した。",
          "invalidates": [
            "request profile assessment",
            "downstream meaning trace"
          ],
          "required_action": "依頼記録を再作成し全下流traceを再評価する。"
        }
      ],
      "authority_boundary": {
        "claim_owner": "human_or_explicitly_authorized_actor",
        "semantic_guard_role": "audit_material_validation_only",
        "decision_authority": "not_applicable",
        "execution_authority": "not_applicable",
        "occurrence_evidence_required": false,
        "final_acceptance_authority": "human_only",
        "prohibited_promotions": [
          "audit_result_implies_final_acceptance"
        ]
      },
      "profile_digest": {
        "algorithm": "sha256",
        "value": "b6daf1856b4463b58a672dac5d57312a24b9b1fcd02e1690e74a930586e7390a"
      }
    },
    {
      "profile_id": "lifecycle-profile.exploration",
      "version": "0.1.0-candidate",
      "status": "pending_human_adoption",
      "stage": "exploration",
      "lifecycle_trace_stage": "exploration_question",
      "purpose": "既知、観測、推論、仮説、未知、未決定を分離し、要求化の前に問うべき事項と判断所有者を明らかにする。",
      "entry_conditions": [
        {
          "condition_id": "exploration.request.bound",
          "statement": "対象付き依頼命題と少なくとも一つの未知又は検討課題がある。",
          "evidence_requirement": "request profile refとunresolved ref"
        }
      ],
      "exit_conditions": [
        {
          "condition_id": "exploration.knowledge.partitioned",
          "statement": "既知事実、推論、仮説、未知、未決定及び質問の判断先が区別される。",
          "evidence_requirement": "由来付き探索記録"
        }
      ],
      "required_semantic_fields": [
        {
          "field_id": "exploration.question",
          "meaning": "答えが範囲又は後続判断を変える問い。",
          "required": true,
          "absence_effect": "blocked"
        },
        {
          "field_id": "exploration.known_facts",
          "meaning": "所在証拠を持つ観測済み事実。",
          "required": true,
          "absence_effect": "unresolved"
        },
        {
          "field_id": "exploration.hypotheses",
          "meaning": "反証条件を持つ暫定説明。",
          "required": true,
          "absence_effect": "unresolved"
        },
        {
          "field_id": "exploration.unknowns",
          "meaning": "未観測又は証拠不足の範囲。",
          "required": true,
          "absence_effect": "unresolved"
        },
        {
          "field_id": "exploration.decision_owner",
          "meaning": "問い又は価値判断を決められる主体。",
          "required": true,
          "absence_effect": "blocked"
        }
      ],
      "required_relationships": [
        {
          "relationship_id": "exploration.question_targets_unknown",
          "subject_role": "question",
          "predicate": "targets",
          "object_role": "unknown",
          "cardinality": "one_or_more",
          "absence_effect": "blocked"
        },
        {
          "relationship_id": "exploration.evidence_tests_hypothesis",
          "subject_role": "evidence",
          "predicate": "supports_or_refutes",
          "object_role": "hypothesis",
          "cardinality": "one_or_more",
          "absence_effect": "unresolved"
        },
        {
          "relationship_id": "exploration.owner_decides_question",